{
  "$schema": "https://json-schema.org/draft/2020-12/schema",
  "$id": "https://kitsoki/session-mining/scenario_ir.schema.json",
  "title": "Scenario Foundry IR (kind: conversation)",
  "description": "A goal-bounded, multi-turn scenario compiled from mined intents + outcomes + satisfaction. Not a trace event type — this sits one layer above the JSONL trace format, compiled from emit.py --outcomes' intents.json + analysis.json. See docs/proposals/scenario-foundry.md#scenario-ir.",
  "type": "object",
  "required": ["schema_version", "kind", "id", "source", "persona", "goal", "turns", "expected_effects", "abandoned"],
  "additionalProperties": true,
  "properties": {
    "schema_version": { "const": "1.0" },
    "kind": { "const": "conversation" },
    "id": {
      "type": "string",
      "pattern": "^scn-.+$",
      "description": "stable scenario id, e.g. scn-<session-slug>-<0000> for mined scenarios"
    },
    "source": {
      "enum": ["mined", "hand-authored"],
      "description": "distinguishes mined scenarios (compiled from a real corpus) from hand-authored gap-fillers; both are valid and coexist"
    },
    "provenance": {
      "type": "object",
      "description": "traces back to the source session for audit/redaction review; always present on source=mined scenarios",
      "required": ["corpus", "session_id", "span_idx"],
      "additionalProperties": false,
      "properties": {
        "corpus": {
          "type": "string",
          "description": "e.g. claude-code, codex"
        },
        "session_id": {
          "type": "string",
          "description": "the mined session id the scenario's first turn was compiled from"
        },
        "span_idx": {
          "type": "integer",
          "minimum": 0,
          "description": "the intent-span index (from instance_id '<session>#<span_idx>') the scenario starts on"
        }
      }
    },
    "persona": {
      "type": "string",
      "description": "coarse actor label the scenario represents (e.g. core-maintainer, bugfix-contributor); mined scenarios derive this heuristically from action tags, hand-checked at calibration"
    },
    "goal": {
      "type": "string",
      "minLength": 1,
      "description": "the user's goal for this scenario span, in their own words (verbatim first-turn text for mined scenarios)"
    },
    "turns": {
      "type": "array",
      "minItems": 1,
      "items": { "$ref": "#/$defs/turn" }
    },
    "expected_effects": {
      "type": "array",
      "items": { "type": "string" },
      "description": "deterministic, checkable outcomes the scenario should produce (derived from grounded mined actions, or hand-written for authored scenarios); may be empty when no action was groundable"
    },
    "abandoned": {
      "type": "boolean",
      "description": "true when the mined span ends without a satisfying outcome (last turn was corrected with no further follow-up in the session) — such a scenario should assert the workbench does NOT silently claim success"
    }
  },
  "allOf": [
    {
      "if": { "properties": { "source": { "const": "mined" } } },
      "then": { "required": ["provenance"] }
    }
  ],
  "$defs": {
    "turn": {
      "type": "object",
      "required": ["role", "text"],
      "additionalProperties": false,
      "properties": {
        "role": {
          "enum": ["user", "assistant"],
          "description": "mined scenarios only ever emit role=user turns today (verbatim user_text per intent span); assistant is reserved for future/hand-authored use"
        },
        "text": {
          "type": "string",
          "description": "verbatim (untruncated) turn text"
        },
        "corrected": {
          "type": "boolean",
          "description": "true when a later turn in the same session structurally or lexically corrected this turn's result (folded from analysis.json's satisfaction.corrected); a recall-biased review flag, not a verdict — see emit.py's satisfaction docstring"
        },
        "corrective_ops": {
          "type": "array",
          "items": { "type": "string" },
          "description": "grounded corrective git ops (e.g. 'git rebase --abort') found in the immediately-following span; present only when corrected is true and at least one op was grounded"
        },
        "followup_text_head": {
          "type": "string",
          "description": "head (<=200 chars) of the user's own next words after this turn, lexically recovered; present only when corrected is true"
        }
      }
    }
  }
}
