{
  "schema_version": "1.0",
  "kind": "conversation",
  "id": "scn-c4d281a2-30e4-4002-9152-59d28d824abc-0000",
  "source": "mined",
  "provenance": {
    "corpus": "claude-code",
    "session_id": "c4d281a2-30e4-4002-9152-59d28d824abc",
    "span_idx": 0
  },
  "persona": "bugfix-contributor",
  "goal": "we have some .kitsoki-owner problem that's preventing us from merging some bug fixes - i was using bug fix in a previous session but it somehow got corrupted and stopped working - check into .kitsoki owner and local worktrees or PRs that are open for bugs 51, 52, etc...",
  "turns": [
    {
      "role": "user",
      "text": "we have some .kitsoki-owner problem that's preventing us from merging some bug fixes - i was using bug fix in a previous session but it somehow got corrupted and stopped working - check into .kitsoki owner and local worktrees or PRs that are open for bugs 51, 52, etc...",
      "corrected": false
    }
  ],
  "expected_effects": [
    "mcp__kitsoki__gh_issues: {<val>:<val>,<val>:<val>,<val>:<val>,<val>:30} completed",
    "mcp__kitsoki__gh_issues: {<val>:<val>,<val>:<val>,<val>:<val>} completed",
    "mcp__kitsoki__gh_pr_view: {<val>:51,<val>:<val>} completed",
    "mcp__kitsoki__host_run: {<val>:<val>,<val>:<val>.kitsoki-owner<val>.kitsoki-owner' 2 completed",
    "mcp__kitsoki__host_run: {<val>:<val>,<val>:<val>} completed",
    "mcp__kitsoki__story_search: {<val>:<val>,<val>:<val>,<val>:50} completed",
    "mcp__kitsoki__studio_ping: {} completed",
    "mcp__kitsoki__vcs_log: {<val>:<val>,<val>:10} completed",
    "mcp__kitsoki__worktree_list: {<val>:<val>} completed"
  ],
  "abandoned": false
}
