{
  "schema_version": "1.0",
  "kind": "conversation",
  "id": "scn-74252840-25f6-4449-85a0-8ad99f7c97d5-0002",
  "source": "mined",
  "provenance": {
    "corpus": "claude-code",
    "session_id": "74252840-25f6-4449-85a0-8ad99f7c97d5",
    "span_idx": 2
  },
  "persona": "feature-implementer",
  "goal": "if make install fails, give a message that maybe make setup is needed",
  "turns": [
    {
      "role": "user",
      "text": "if make install fails, give a message that maybe make setup is needed",
      "corrected": false
    }
  ],
  "expected_effects": [
    "Bash: git add Makefile && git commit -m <val>EOF' build: hint `mak completed",
    "Bash: make check-deps && echo <val>; PATH=<val> make check-deps; e completed",
    "Edit: <path> completed",
    "Read: <path> completed"
  ],
  "abandoned": false
}
