{
  "schema_version": "1.0",
  "kind": "conversation",
  "id": "scn-74252840-25f6-4449-85a0-8ad99f7c97d5-0000",
  "source": "mined",
  "provenance": {
    "corpus": "claude-code",
    "session_id": "74252840-25f6-4449-85a0-8ad99f7c97d5",
    "span_idx": 0
  },
  "persona": "feature-implementer",
  "goal": "this repo is fresh on this machine - i want make install to run cleanly, there should be some make setup job that will install everything necessary so users don't have to do it - cover mac, rockylinux and debian/ubuntu style",
  "turns": [
    {
      "role": "user",
      "text": "this repo is fresh on this machine - i want make install to run cleanly, there should be some make setup job that will install everything necessary so users don't have to do it - cover mac, rockylinux and debian/ubuntu style",
      "corrected": false
    }
  ],
  "expected_effects": [
    "Bash: git add scripts/<file> Makefile && git status --short && g completed",
    "Bash: git commit -m <val>EOF' build: add `make setup` to install d completed",
    "Bash: ls -la && cat Makefile 2>/dev/null | head -100 completed",
    "Bash: ls test/e2e; echo <val>; find test/e2e -name <val> -exec cat completed",
    "Bash: make install 2>&1 | tail -15 completed",
    "Bash: make setup 2>&1 | tail -25 completed",
    "Bash: tail -n +100 Makefile; echo <val>; head -5 go.mod; echo <val completed",
    "Edit: <path> completed",
    "Write: <path> completed"
  ],
  "abandoned": false
}
