{
  "schema_version": "1.0",
  "kind": "conversation",
  "id": "scn-f7b1da36-dd82-4111-93d8-706bf032e786-0001",
  "source": "mined",
  "provenance": {
    "corpus": "claude-code",
    "session_id": "f7b1da36-dd82-4111-93d8-706bf032e786",
    "span_idx": 1
  },
  "persona": "verifier",
  "goal": "ok it has been resized - i turned it on, check that it starts up properly",
  "turns": [
    {
      "role": "user",
      "text": "ok it has been resized - i turned it on, check that it starts up properly",
      "corrected": false
    }
  ],
  "expected_effects": [
    "Bash: for i in $(seq 1 6); do ssh -o ConnectTimeout=8 -o BatchMode completed",
    "Bash: ssh root@<IP> <val>=== local listener ===<val> [lo completed",
    "Bash: ssh root@<IP> <val>=== resources (post-resize) === completed"
  ],
  "abandoned": false
}
