{
  "schema_version": "1.0",
  "kind": "conversation",
  "id": "scn-rollout-2026-06-22t14-52-39-019eee51-34a1-77e3-af6a-9c82cc702370-0000",
  "source": "mined",
  "provenance": {
    "corpus": "codex",
    "session_id": "rollout-2026-06-22T14-52-39-019eee51-34a1-77e3-af6a-9c82cc702370",
    "span_idx": 0
  },
  "persona": "core-maintainer",
  "goal": "is the agent-contract-eval worktree already merged? can it be removed?",
  "turns": [
    {
      "role": "user",
      "text": "is the agent-contract-eval worktree already merged? can it be removed?",
      "corrected": false
    }
  ],
  "expected_effects": [
    "exec_command: git -C .worktrees/agent-contract-eval status --short --branc completed",
    "exec_command: git branch --contains a77549c47291d2cb6c542ea1e340a28fef2449 completed",
    "exec_command: git merge-base --is-ancestor a77549c47291d2cb6c542ea1e340a28 completed",
    "exec_command: rg -n <val> <path> completed"
  ],
  "abandoned": false
}
